{
  "schemaVersion": "1.0",
  "analysisId": "11111111-1111-4111-8111-111111111111",
  "targetJob": "BACKEND",
  "targetCareerLevel": "ENTRY",
  "analysisPurpose": "PORTFOLIO_ANALYSIS",
  "requestedAnalysisDepth": "P2",
  "extractorVersion": "p0-p1-p2-collector-1.0",
  "repositories": [
    {
      "repositoryId": "123",
      "repositoryFullName": "git-ddo/backend",
      "defaultBranch": "main",
      "snapshotHashAlgorithm": "SHA1",
      "snapshotSha": "commit-sha",
      "completedEvidenceLevels": ["P0", "P1", "P2"],
      "collectionWarnings": [],
      "userClaims": [
        {
          "claimId": "claim_001",
          "statement": "API를 구현했습니다.",
          "participationLevel": "LEAD",
          "participationStartedOn": null,
          "participationEndedOn": null,
          "relatedEvidenceRefs": []
        }
      ],
      "evidence": [
        {
          "evidenceId": "ev_001",
          "evidenceType": "GITHUB_STATIC",
          "analysisDepth": "P0",
          "repositoryId": "123",
          "repositoryFullName": "git-ddo/backend",
          "snapshotHashAlgorithm": "SHA1",
          "snapshotSha": "commit-sha",
          "factKey": "README",
          "valueType": "STRING",
          "value": "# Backend",
          "path": "README.md",
          "startLine": null,
          "endLine": null,
          "commitSha": "commit-sha",
          "pullRequestNumber": null,
          "sourceEvidenceRefs": [],
          "derivedFromLevel": null
        },
        {
          "evidenceId": "ev_002",
          "evidenceType": "GITHUB_ACTIVITY",
          "analysisDepth": "P1",
          "repositoryId": "123",
          "repositoryFullName": "git-ddo/backend",
          "snapshotHashAlgorithm": "SHA1",
          "snapshotSha": "commit-sha",
          "factKey": "COMMIT_SUMMARY",
          "valueType": "STRING",
          "value": "sha=abc123\nmessage=Implement auth filter",
          "path": null,
          "startLine": null,
          "endLine": null,
          "commitSha": "abc123",
          "pullRequestNumber": null,
          "sourceEvidenceRefs": [],
          "derivedFromLevel": null
        },
        {
          "evidenceId": "ev_003",
          "evidenceType": "GITHUB_ACTIVITY",
          "analysisDepth": "P1",
          "repositoryId": "123",
          "repositoryFullName": "git-ddo/backend",
          "snapshotHashAlgorithm": "SHA1",
          "snapshotSha": "commit-sha",
          "factKey": "CHANGED_FILES",
          "valueType": "STRING",
          "value": "sha=abc123\nfiles:\nadded\tsrc/AuthFilter.java\t+20/-1",
          "path": null,
          "startLine": null,
          "endLine": null,
          "commitSha": "abc123",
          "pullRequestNumber": null,
          "sourceEvidenceRefs": ["ev_002"],
          "derivedFromLevel": null
        },
        {
          "evidenceId": "ev_005",
          "evidenceType": "CODE_EVIDENCE",
          "analysisDepth": "P2",
          "repositoryId": "123",
          "repositoryFullName": "git-ddo/backend",
          "snapshotHashAlgorithm": "SHA1",
          "snapshotSha": "commit-sha",
          "factKey": "CODE_SNIPPET",
          "valueType": "STRING",
          "value": "public class AuthFilter {\n    public boolean matches(String path) {\n        return path.startsWith(\"/api\");\n    }\n}",
          "path": "src/AuthFilter.java",
          "startLine": 5,
          "endLine": 9,
          "commitSha": "abc123",
          "pullRequestNumber": null,
          "sourceEvidenceRefs": ["ev_002"],
          "derivedFromLevel": null
        }
      ]
    }
  ]
}
