{
  "schemaVersion": "1.0",
  "analysisId": "11111111-1111-4111-8111-111111111111",
  "targetJob": "BACKEND",
  "targetCareerLevel": "ENTRY",
  "analysisPurpose": "PORTFOLIO_ANALYSIS",
  "requestedAnalysisDepth": "P0",
  "extractorVersion": "p0-collector-1.0",
  "repositories": [
    {
      "repositoryId": "123",
      "repositoryFullName": "git-ddo/backend",
      "defaultBranch": "main",
      "snapshotHashAlgorithm": "SHA1",
      "snapshotSha": "commit-sha",
      "completedEvidenceLevels": ["P0"],
      "collectionWarnings": [],
      "userClaims": [
        {
          "claimId": "claim_001",
          "statement": "API를 구현했습니다.",
          "participationLevel": "LEAD",
          "participationStartedOn": null,
          "participationEndedOn": null,
          "relatedEvidenceRefs": []
        }
      ],
      "evidence": [
        {
          "evidenceId": "ev_001",
          "evidenceType": "GITHUB_STATIC",
          "analysisDepth": "P0",
          "repositoryId": "123",
          "repositoryFullName": "git-ddo/backend",
          "snapshotHashAlgorithm": "SHA1",
          "snapshotSha": "commit-sha",
          "factKey": "README",
          "valueType": "STRING",
          "value": "# Backend",
          "path": "README.md",
          "startLine": null,
          "endLine": null,
          "commitSha": "commit-sha",
          "pullRequestNumber": null,
          "sourceEvidenceRefs": [],
          "derivedFromLevel": null
        }
      ]
    }
  ]
}
