{
  "schemaVersion": "1.0",
  "analysisId": "11111111-1111-4111-8111-111111111111",
  "targetJob": "BACKEND",
  "targetCareerLevel": "ENTRY",
  "analysisPurpose": "PORTFOLIO_ANALYSIS",
  "requestedAnalysisDepth": "P1",
  "extractorVersion": "p0-p1-collector-1.0",
  "repositories": [
    {
      "repositoryId": "123",
      "repositoryFullName": "git-ddo/backend",
      "defaultBranch": "main",
      "snapshotHashAlgorithm": "SHA1",
      "snapshotSha": "commit-sha",
      "completedEvidenceLevels": ["P0", "P1"],
      "collectionWarnings": [],
      "userClaims": [
        {
          "claimId": "claim_001",
          "statement": "API를 구현했습니다.",
          "participationLevel": "LEAD",
          "participationStartedOn": null,
          "participationEndedOn": null,
          "relatedEvidenceRefs": []
        }
      ],
      "evidence": [
        {
          "evidenceId": "ev_001",
          "evidenceType": "GITHUB_STATIC",
          "analysisDepth": "P0",
          "repositoryId": "123",
          "repositoryFullName": "git-ddo/backend",
          "snapshotHashAlgorithm": "SHA1",
          "snapshotSha": "commit-sha",
          "factKey": "README",
          "valueType": "STRING",
          "value": "# Backend",
          "path": "README.md",
          "startLine": null,
          "endLine": null,
          "commitSha": "commit-sha",
          "pullRequestNumber": null,
          "sourceEvidenceRefs": [],
          "derivedFromLevel": null
        },
        {
          "evidenceId": "ev_002",
          "evidenceType": "GITHUB_ACTIVITY",
          "analysisDepth": "P1",
          "repositoryId": "123",
          "repositoryFullName": "git-ddo/backend",
          "snapshotHashAlgorithm": "SHA1",
          "snapshotSha": "commit-sha",
          "factKey": "COMMIT_SUMMARY",
          "valueType": "STRING",
          "value": "sha=abc123\nauthor=git-ddo-user\nauthoredAt=2026-08-01T12:00:00Z\nmessage=Implement auth filter",
          "path": null,
          "startLine": null,
          "endLine": null,
          "commitSha": "abc123",
          "pullRequestNumber": null,
          "sourceEvidenceRefs": [],
          "derivedFromLevel": null
        },
        {
          "evidenceId": "ev_003",
          "evidenceType": "GITHUB_ACTIVITY",
          "analysisDepth": "P1",
          "repositoryId": "123",
          "repositoryFullName": "git-ddo/backend",
          "snapshotHashAlgorithm": "SHA1",
          "snapshotSha": "commit-sha",
          "factKey": "CHANGED_FILES",
          "valueType": "STRING",
          "value": "sha=abc123\nadditions=20\ndeletions=1\ntruncatedFiles=false\nfiles:\nadded\tsrc/AuthFilter.java\t+20/-1",
          "path": null,
          "startLine": null,
          "endLine": null,
          "commitSha": "abc123",
          "pullRequestNumber": null,
          "sourceEvidenceRefs": ["ev_002"],
          "derivedFromLevel": null
        },
        {
          "evidenceId": "ev_004",
          "evidenceType": "GITHUB_ACTIVITY",
          "analysisDepth": "P1",
          "repositoryId": "123",
          "repositoryFullName": "git-ddo/backend",
          "snapshotHashAlgorithm": "SHA1",
          "snapshotSha": "commit-sha",
          "factKey": "PULL_REQUEST",
          "valueType": "STRING",
          "value": "number=12\ntitle=Add auth filter\nstate=closed\nmerged=true",
          "path": null,
          "startLine": null,
          "endLine": null,
          "commitSha": "def456",
          "pullRequestNumber": 12,
          "sourceEvidenceRefs": [],
          "derivedFromLevel": null
        }
      ]
    }
  ]
}
